PRODUCT_NAME,Service Summary,Price Summary,Effect Summary,Quality Summary
Moisture Matte Longstay Lipstick - 2g | Citrus Nude	,No Data Available,No Data Available,No Data Available,No Data Available
Moisture Matte Longstay Lipstick - 2g | Berrylicious Magenta,No Data Available,No Data Available,No Data Available,No Data Available
Moisture Matte Longstay Lipstick -2g  | Cherry Punch	,No Data Available,No Data Available,No Data Available,No Data Available
Moisture Matte Long Stay Lipstick - 2g | Pink Lemonade,No Data Available,No Data Available,No Data Available,No Data Available
Vitamin C Daily Glow Face Cream - 80 g - Pack of 2,No Data Available,No Data Available,No Data Available,No Data Available
ME White Musk Eau De Parfum For a Fragrance Closest To Your Skin - 50 ml,No Data Available,No Data Available,No Data Available,No Data Available
ME Floral Eau De Parfum - Live in the Moment - 50 ml,No Data Available,No Data Available,No Data Available,No Data Available
ME Oud Eau De Parfum to Unleash Your Confidence - 50 ml,No Data Available,No Data Available,No Data Available,No Data Available
ME Aqua Eau De Parfum For a Wave Of Freshness - 50 ml,No Data Available,No Data Available,No Data Available,No Data Available
ME First Rain Eau De Parfum to Refresh Your Senses - 50 ml,No Data Available,No Data Available,No Data Available,No Data Available
Ubtan Facial Kit with Turmeric & Saffron for Glowing Skin - 60 g,No Data Available,No Data Available,No Data Available,No Data Available
Vitamin C Facial Kit with Vitamin C & Turmeric for Skin Illumination - 60 g,No Data Available,No Data Available,No Data Available,No Data Available
Lash Care Volumizing Mascara with Castor Oil & Almond Oil for 2X Instant Volume - 13 g,No Data Available,No Data Available,No Data Available,No Data Available
Glow Mattifying Loose Powder with Vitamin C & Aloe Vera for a Natural Matte Look - 12 g ,No Data Available,No Data Available,No Data Available,No Data Available
Oil-Free Face Wash with Apple Cider Vinegar & Salicylic Acid for Acne-Prone Skin– 250 ml,No Data Available,No Data Available,No Data Available,No Data Available
Vitamin C Daily Glow Face Cream With Vitamin C & Turmeric for Skin Illumination - 80 g,No Data Available,No Data Available,No Data Available,Good quality and good value for money.
Green Tea Face Wash With Green Tea & Collagen For Open Pores - 100 ml,No Data Available,this is a gentle cleanser that is still effective. it's cruelty-free and made safe at such a low price.,No Data Available,it's potent and high in quality and quantity. it truly nourishes your skin.
Onion Shampoo with Onion and Plant Keratin for Hair Fall Control - 200ml,No Data Available,my neighbour recommended me this mama's onion shampoo. my hair feels so soft and smoother after starting using it. the mama earth onion shampoo price is also okay.,No Data Available,the mama earth onion shampoo review present are so positive. i found them all true after using this shampoo for almost 3 months.
Green Tea Face Serum With Green Tea & Collagen For Open Pores - 30 ml,No Data Available,i purchased it during a sitewide sale so got a decent price. i really like how this product makes my skin feel and smell.,No Data Available,I purchased it during a sitewide sale so got a decent price. I really like how this product makes my skin feel and smell.
Green Tea Face Toner With Green Tea & Collagen For Open Pores - 100 ml,No Data Available,No Data Available,No Data Available,No Data Available
Green Tea Night Cream With Green Tea & Collagen For Open Pores - 50 g,No Data Available,green tea night cream comes at a reasonable price and is good in quality. it smells very nice and comes at a good price.,this night gel works wonders on my skin without causing any side effects. i am reviewing this after using it 4 times..No side effects at all...Totally go for it.,I used to have itchy and reddish face skin and everything I tried made it really dry. after using green tea night cream my skin quality improved.
Green Tea Serum Gel with Green Tea & Collagen for Open Pores - 50 ml,No Data Available,"my face feels soft, smooth, and hydrated with a matte finish. I bought it during sale so got it at half the price.","I have skin lupus and am usually hypersensitive to products. I had no negative side effects, which was a pleasant surprise!",my husband & 1 both use this product.
Green Tea Day Cream With Green Tea & Collagen For Open Pores - 50 g,No Data Available,it is safe certified and it also gives 24-hour intense hydration. best quality at the best price.,this day cream is made safe certified and is safe for all skin types. trust me guys...this day cream is safe for all skin types.,my bestie offered me this cream and I am very happy with the quality. it never lets the skin dry and gives 24-hour intense hydration. thanks Mamaearth for making my skin so good in quality.
Natural Henna Combo ,No Data Available,No Data Available,No Data Available,No Data Available
Henna Paste 200 g (Pack of 2),No Data Available,Mamaearth natural henna paste is so affordable than many hair dyes. it helped in reducing hair damage and naturally color the gray hair. i used to ignore applying any color or mehndi to my hair bcz of laziness.,No Data Available,Mamaearth mehndi paste price is so affordable and the quality is at its best. i used to ignore applying any color or mehndi to my hair bcz of laziness...but this just solved it!
Ubtan Face Wash 150 ml (Pack of 2),No Data Available,No Data Available,No Data Available,Very good quality products.
Charcoal Black Long Stay Kajal 0.35 g - Pack of 2,No Data Available,No Data Available,No Data Available,No Data Available
Onion Shampoo with Onion and Plant Keratin for Hair Fall Control - 250ml,No Data Available,mamaearth onion shampoo has the potential of keeping scalp hydrated and healthy. i was facing hair fall problem and I was looking for a hair growth shampoo that suites my hair type and I was not getting any option. my neighbour recommended me this mama's onion shampoo...and m glad she did!,this onion hair mazk by mamaearth is effective and is very. I use v lil n it spreads on hair very fast...,mamaearth onion shampoo 250ml price is totaly worthy according to the quality of the product and results. i love it and my husband uses all products from mamaearth only....
Coco Soft Body Wash For Babies With Coconut Milk & Turmeric - 400 ml,No Data Available,No Data Available,No Data Available,No Data Available
Coco Soft Shampoo with Coconut Milk & Turmeric for Gentle Cleansing - 400 ml,No Data Available,No Data Available,No Data Available,No Data Available
Coco Soft Body Lotion with Coconut Milk & Turmeric for 24-Hour Moisturization - 400 ml,No Data Available,No Data Available,No Data Available,No Data Available
Coco Soft Face Cream With Coconut Milk & Turmeric For Babies - 60 g,No Data Available,No Data Available,No Data Available,No Data Available
Vitamin C Face Wash with Vitamin C and Turmeric for Skin Illumination - 80ml,No Data Available,No Data Available,No Data Available,No Data Available
Coco Soft Bathing Bar for Babies with Coconut Oil & Turmeric for Babies - Pack of 2*75g,No Data Available,No Data Available,No Data Available,No Data Available
Coco Soft Massage Oil with Coconut & Turmeric Oil for Babies - 200 ml,No Data Available,No Data Available,No Data Available,No Data Available
Eggplex Conditioner with Egg Protein & Collagen for Strength & Shine - 250 ml,No Data Available,i have used many products on my hair... but this is the best for my hair. it is of very good quality and comes at a very pocket friendly price.,No Data Available,my sister had rough and dry hair so I ordered this for her and she is loving it. she applies it thrice a week and it has changed her hair quality. it is of very good quality and comes at a very pocket friendly price.
Eggplex Shampoo with Egg Protein & Collagen for Strength and Shine - 250 ml,No Data Available,Eggplex Shampoo by Mamaearth is a decent shampoo. It works as promised. It makes the hair smooth. The quality is really good and comes at a fair price.,No Data Available,I read a lot of reviews about this product and it was quite fascinating so I ordered one. after using it for 2 weeks my hair feels smoother and thicker after only a couple of days. it contains egg protein and collagen in it.
Soothing Waterproof Eyeliner with Almond Oil & Castor Oil for 10 Hour Long Stay - 3.5 ml,No Data Available,No Data Available,No Data Available,No Data Available
Ubtan Face Wash with Turmeric & Saffron for Tan Removal – 150 ml,No Data Available,"mamaearth ubtan face wash was given to my niece, who has a lot of skin problems on her face. it has also worked wonders for her.",mamaearth ubtan face wash says it's a skin-lighting face wash. it leaves my skin squeaky clean and makes it brighter. i really love the fragrance of this face wash.,No Data Available
Glow Hydrating Concealer - 6 ml | Nude Glow,No Data Available,No Data Available,No Data Available,No Data Available
Glow Hydrating Concealer - 6 ml | Creme Glow,No Data Available,No Data Available,No Data Available,No Data Available
Glow Hydrating Concealer - 6 ml | Ivory Glow,No Data Available,No Data Available,No Data Available,No Data Available
Skin Illuminate Sunscreen Gel SPF 50 with Vitamin C & Turmeric for UVA & B Protection - 50 g,No Data Available,skin Illuminate sunscreen gel is having SPF 50 also having Vitamin C n Turmeric for UVA so it protects V v well n the vit c is giving a good glow also.,"it has the perfect light weight formula, and absorbs so well into the skin. the best part is it has no side effects and does not leave any white cast.",this sunscreen is very effective and prevents tanning. it has aloe vera goodness which is really good for all skin types.
Vitamin C Foaming Face Wash Combo Pack with Refill - 150ml + 150ml,i received this face wash today...so quick service...ordered yesterday and got it delivered today.... Lovely packaging and good quantity at a fair price....,"this face wash is loaded with antioxidants as well as brightening and acne-preventing properties. it is also free from harmful chemicals, so this is all natural and the best face wash available in the market.",i got this as a gift but it is very good for my skin. Haven’t faced any side effects.,i got this as a gift but it is very good for my skin. Haven’t faced any side effects.
Sunscreen Body Lotion with SPF 30 - 300 ml | Vitamin C,No Data Available,Mamaearth has launched the sunscreen body lotion spf 30 variant in india. it is a mild yellow-colored product which blends well into the skin.,No Data Available,No Data Available
Sunscreen Body Lotion SPF 30 - 300 ml | Ubtan,No Data Available,No Data Available,No Data Available,No Data Available
Sunscreen Body Lotion SPF 30 - 300 ml | Aloe Vera,No Data Available,Mamaearth has made my skin care routine super easy! no doubt all its products are very natural with no toxins at all.,I like dry touch sunscreen and that's why I chose this sunscreen lotion by Mamaearth. it has no side effects. SPF 30 keeps your skin protected and prevents sun damage.,"Whenever I apply any cream or lotion, it becomes a bit sweaty but this lotion by Mama earth is uniquely made with non sticky formula...Exactly what I was looking for. the product quality is too good and the packaging is excellent. It fully protects the body from tan."
Mamaearth ME Deo for a Scent That’s Unique to You  - 120 ml,i got this product on sale and I liked it when I received it. such a nice packaging.,"Definitely a good deo, it has a great fragrance and lasts for a long time as described. i am now a true true fan of Mamaearth. after using this deodorant, I really enjoy my day without the fear of body odour.",made with a unique formula and all natural ingredients. doesn't have any side effects like itchy or burning sensation.,my cousin introduced this deo to me and I like the quality. the smell is also very soothing and lasts up to 8 hrs which is almost the entire day.
Rice Face Serum With Rice Water & Niacinamide for Glass Skin - 30 ml,No Data Available,"Mamaearth rice water serum works equally well for women and men. it hydrates, provides skin glow, makes spots less visible, and evens skin texture. everyone in my family uses it.","i waited to buy this for so long as it was out of stock....this has amazing effects. rice water content hydrates the skin, soothes inflammation, and brightens the skin.",my sister got this face serum specially for me all the way from Delhi... I am liking it!! It has improved my skin's efficiency and has eliminated the pimple spots and other scars too.
Rice Oil-Free Face Moisturizer With Rice Water & Niacinamide for Glass Skin - 80 g,No Data Available,This is a product that price that is worth product that price that price.,No Data Available,No Data Available
Rice Face Scrub With Rice Water & Niacinamide for Glass Skin - 100 g,No Data Available,No Data Available,"Mamaearth rice face scrub with rice water soothes my skin texture and removes dead skin layer. it also exfoliates skin, unclogs pores, brightens skin tone, besides providing 24-hour hydration.",No Data Available
Rice Face Wash With Rice Water & Niacinamide for Glass Skin - 100 ml,No Data Available,rice is one of the most used secret ingredient in korean skincares. rice is used to make skin glass like.,No side effects. Good for oily sensitive skin.,rice water face wash is superb. my fav one right now. Using it from a week and my skin feels like smoothness.
Rice Gel Face Moisturizer With Rice Water & Niacinamide for Glass Skin - 100 ml,No Data Available,No Data Available,No Data Available,This product is very good quality and so easy use in every night and day.
Rice Night Cream With Rice Water & Niacinamide for Glass Skin - 50 g,No Data Available,No Data Available,No Data Available,No Data Available
Rice Day Cream With Rice Water & Niacinamide for Glass Skin - 50 g,No Data Available,Mamaearth rice day cream is an amazing moisturizer for hydrated skin. contains natural ingredients that work for females too.,this is so light and gets into the skin immediately. the effects are also instant.,Owesome products quality.
Rice Sleeping Face Mask With Rice Water & Niacinamide for Glass Skin - 100 ml,No Data Available,No Data Available,No Data Available,No Data Available
Hair Oil Booster - 30 ml | Almond,No Data Available,i was facing hair fall prblm and after using this i my problem of hair fall was solved. it is so so so convenient in terms of usage and the price is also fair enough.,i have used many hair fall products but this oil booster by Mama earth shows instant result. it is dermatologically tested with non-sticky formula. it does not have any side effects...trust me!!,after using this almond benefits oil booster for 2-3 times only you can fill the difference. my mom got this for me from the offline store which is near my place.
Hair Oil Booster - 30 ml | Rice,this is my first purchase from Mamaearth and I had a nice experience. this product has Keratin which is very important for hair growth. the fragrance is mild and soothing.,No Data Available,Mamaearth hair oil booster is great for hair care. it starts showing its effects within a few initial uses.,i ordered this oil booster for my wife and she is loving it. her hair fall has reduced and the hair quality has improved a lot. my hair quality has improved and become very smooth.
Hair Oil Booster - 30 ml | Tea Tree,No Data Available,No Data Available,tea tree oil really works against dandruff and doesn't have any side effects. the packaging was also superb..much appreciated!!,this oil has reduced my itchiness and most importantly no more hair fall. my hair has become stronger and thicker and my scalp is not itchy anymore.
Hair Oil Booster - 30 ml | Onion,No Data Available,No Data Available,"onion hair oil Booster is a game-changer for me. there was no side effect, it has made my hair thick and Reduces hair fall. highly recommended for both males and females.",onion oil booster has definitely made a difference to my hair quality. i am also regular with my hair massage.
Skin Illuminate Face Cream with Vitamin C and Turmeric for Radiant Skin – 80 g,No Data Available,No Data Available,No Data Available,No Data Available
Aloe Vera Gel Moisturizer with Aloe Vera & Ashwagandha for a Youthful Glow - 100 g,No Data Available,"i've tried other aloe gels, they did not work as well as this probably because it's organic.",the gel is really mild and there was no negative impact on my sensitive skin. it's really soothing and got absorbed really quickly without leaving any residue.,the slight fragrance is also pleasant but not at all irritating.
Aloe Vera Sunscreen Face Serum with Aloe Vera & Ashwagandha for UVA & B Protection - 30 ml,No Data Available,No Data Available,No Data Available,No Data Available
Aloe Vera Oil-Free Face Moisturizer with Aloe Vera & Ashwagandha for a Youthful Glow - 80 g,No Data Available,No Data Available,No Data Available,No Data Available
 Glow Oil Control Compact With SPF 30 - 9g | Almond Glow,No Data Available,No Data Available,No Data Available,No Data Available
 Glow Oil Control Compact With SPF 30 - 9g | Nude Glow,No Data Available,No Data Available,No Data Available,No Data Available
 Glow Oil Control Compact With SPF 30 - 9g | Creme Glow,No Data Available,No Data Available,No Data Available,No Data Available
 Glow Oil Control Compact With SPF 30 - 9g |Ivory Glow,No Data Available,No Data Available,No Data Available,No Data Available
12 Months,No Data Available,No Data Available,No Data Available,No Data Available
6 Months,No Data Available,No Data Available,No Data Available,No Data Available
3 Months,No Data Available,No Data Available,No Data Available,No Data Available
Onion Hair Styling Cream for Men with Onion & Redensyl for Nourishment & Styling- 100 g,No Data Available,Definitely recommend this hair style cream to all the boys. comes at a fair price when compared to other hair cream.,Mamaearth hair styling cream has a strong hold and gives a nice finish to my hair and doesn't cause any harm or side effects. it is naturally made and has Vitamin E in it.,"this hair styling cream gives strength to hold the hair, which is pretty good. it's easy to use and washes off quickly."
Natural Henna Paste with Henna & Dark Roasted Coffee for Rich Naturally Colored Hair - 200 g,No Data Available,Mamaearth natural henna paste price is so affordable than many hair dyes. it helped in reducing hair damage and naturally color the gray hair.,Like So much liked it. Like So much liked it.,Mamaearth mehndi paste price is so affordable...just can't stress enough...How much it just eased up my life!
Foaming Face Wash For Kids With Aloe Vera & Coconut For Gentle Cleansing- 150 ml ,No Data Available,not bad for the price! As gentle as can be.,No Data Available,i am so impressed by the quality of this product. it's safe and doesn't contain any harsh chemicals.
Henna Shampoo with Henna and Deep Roast Coffee for Premature Greying - 250 ml,No Data Available,No Data Available,No Data Available,No Data Available
Henna Conditioner with Henna and Deep Roast Coffee for Premature Greying - 250 ml,No Data Available,No Data Available,No Data Available,No Data Available
Henna Hair Oil with Henna & Coffee Oil for Premature Graying - 150 ml,No Data Available,No Data Available,regular use can help. hair becomes dark black.,No Data Available
Aloe Vera Sleeping Mask with Aloe Vera & Ashwagandha for a Youthful Glow - 100 g,No Data Available,No Data Available,this Aloe Vera sleeping mask has been a helpful product for me.,"I love the clean quality ingredients, and so so effective in giving a supple glow and moisture to my skin. will purchase again."
Aloe Vera Face Serum with Aloe Vera & Ashwagandha for a Youthful Glow– 30 ml,No Data Available,No Data Available,No Data Available,No Data Available
Aloe Ashwagandha Gel with Aloe Vera & Ashwagandha for a Youthful Glow - 300 ml,No Data Available,Super proud but price is to be little bit low.,No Data Available,No Data Available
 Aloe Vera Face Wash with Aloe Vera & Ashwagandha for a Youthful Glow - 100 ml,Nice dilivery free service avilable to Nice dilivery free service avilable to Nice dilivery free service avilable to,No Data Available,Mamaearth aloe vera face wash has given me cooling and refreshing effect to the skin...Skin is improving!,No Data Available
Aloe Vera Night Cream with Aloe Vera and Ashwagandha for a Youthful Glow – 50 g,No Data Available,No Data Available,No Data Available,No Data Available
Aloe Vera Day Cream with Aloe Vera & Ashwagandha for a Youthful Glow - 50 g,No Data Available,"Mamaearth has provided us with the best Aloe Vera Day Cream. it has all you need – Sun protection, Hydration, suppleness, and that glow we usually crave. also, it is made with Aloe Vera and Ashwagandha, which are naturally safe for all.","Mamaearth has provided us with the best Aloe Vera Day Cream. it has all you need – Sun protection, Hydration, suppleness, and that glow we usually crave. also, it is made with Aloe Vera and Ashwagandha, which are naturally safe for all.",No Data Available
Glow Serum Foundation-Toffee Glow,No Data Available,No Data Available,No Data Available,No Data Available
Glow Serum Foundation-Almond Glow,No Data Available,No Data Available,No Data Available,No Data Available
Glow Serum Foundation-Beige Glow,No Data Available,No Data Available,No Data Available,No Data Available
Glow Serum Foundation-Sand Glow,No Data Available,No Data Available,No Data Available,No Data Available
Glow Serum Foundation-Nude Glow,No Data Available,No Data Available,No Data Available,No Data Available
Glow Serum Foundation-Crème Glow,No Data Available,No Data Available,No Data Available,No Data Available
Glow Serum Foundation-Ivory glow,No Data Available,No Data Available,No Data Available,No Data Available
Vitamin C Underarm Scrub with Vitamin C and Turmeric for Brighter Underarms – 50 g,No Data Available,this Vitamin C Underarm Scrub is the best product at this price. i personally thought these lightning products were just hyped.,Mamaearth's Vitamin C Underarm Scrub cures the skin by removing dead skin and is very soft and gentle. it is a natural product and has no side effects. it won't burn and is skin friendly.,No Data Available
Vitamin C Underarm Mask with Vitamin C & Turmeric for Brighter Underarms - 50 g,No Data Available,No Data Available,the mask is super good. Feels light and natural.,No Data Available
Vitamin C Underarm Cream with Vitamin C & Turmeric for Brighter Underarms  – 50 g,No Data Available,No Data Available,"I was so worried about the effectiveness of this product but no worries. after 20 days my underarms have become lighter and much smoother. this cream has a wonderful scent, no side effects and it is made of all-natural ingredients.",No Data Available
Agent Apple Body Wash for Kids with Apple & Oat Protein – 300 ml (Pack of 2),No Data Available,No Data Available,No Data Available,No Data Available
Major Mango Body Wash For Kids with Mango & Oat Protein - 300 ml (Pack of 2),No Data Available,No Data Available,No Data Available,No Data Available
Super Strawberry Body Lotion for Kids With Strawberry & Shea Butter - 400 ml (Pack of 2),No Data Available,No Data Available,No Data Available,No Data Available
Original Orange Body Lotion For Kids With Orange & Shea Butter - 400 ml (Pack of 2),No Data Available,No Data Available,No Data Available,No Data Available
Major Mango Body Lotion For Kids with Mango Butter & Milk Protein - 400 ml (Pack of 2),No Data Available,No Data Available,No Data Available,No Data Available
Agent Apple Body Lotion for Kids with Apple & Oat Milk– 400 ml (Pack of 2),No Data Available,No Data Available,No Data Available,No Data Available
Moisture Matte Long Stay Lipstick - 2g | Espresso Brown,No Data Available,i recently bought this matte light brown lipstick for face and it gave me a buttery smooth finish.,No Data Available,"i gifted this matte lipstick to my bestfriend and she loved it. the colour, quality, packing and delivery too was excellent."
Moisture Matte Long Stay Lipstick - 2g | Pink Tulip,No Data Available,i recently bought this matte light brown lipstick for face and it gave me a buttery smooth finish.,Very nice color ans it last longer with no side effects.,the no chemical feel on my lips makes me forget am wearing my lipstick.
Moisture Matte Long Stay Lipstick - 2g | Raspberry Scarlet,No Data Available,No Data Available,No Data Available,No Data Available
Moisture Matte Long Stay Lipstick - 2g | Melon Red,No Data Available,No Data Available,No Data Available,Sehr nice quality.
Moisture Matte Long Stay Lipstick - 2g | Bubblegum Nude,No Data Available,No Data Available,No Data Available,No Data Available
Moisture Matte Long Stay Lipstick - 2g | Cinnamon Nude,No Data Available,No Data Available,No Data Available,love this...very good quality.....very good quality.....very good quality.....very good quality.....very good quality.....very good quality.....very good quality.....very good quality.....very good quality.....very good quality.....very good quality.....very good quality.....very good quality.....very good quality.....very good quality.....very good quality.....very good quality.....very good quality.....very good quality.....very good quality.....very good quality.....very good quality.....very good quality.....very good quality.....very good quality.....very good quality.....very good quality.....very good
Moisture Matte Long Stay Lipstick - 2g | Candyfloss Pink,No Data Available,No Data Available,No Data Available,Vary smooth and super quality i love it.
Moisture Matte Long Stay Lipstick - 2g | Plum Punch,No Data Available,No Data Available,No Data Available,I like the quality of all your products Just amazing quality The lipstick plum punch is super awesome.
