PRODUCT_NAME,Service Summary,Price Summary,Effect Summary,Quality Summary
Moisture Matte Long Stay Lipstick - 2g | Carnation Nude,No Data Available,mamaearth is one of the best at reasonable price...thank you mamaearth.,No Data Available,No Data Available
Roots of Radiance Essence Serum with Ashwagandha & Turmeric for Radiant Skin – 30 ml,No Data Available,Radiance EssencSerum has reduced the dark spots on my skin. my skin has rejuvenated and feels much fresher.,"my brother has a lot of pimples on his face..i wanted to gift him this serum...and I did it. after using it for 3 weeks, his skin started getting clearer...no side effects of it.",my sister had acne prone skin...so I ordered this Radiance Essence Serum..she is using it since 4 weeks...no new acne has emmerged...I started noticing brighter skin after just 2 weeks!
Leaves of Clarity Essence Serum with Neem & Salicylic Acid for Clear Skin– 30 ml,No Data Available,No Data Available,"neem & salicylic acid serum removes acne, makes skin clear, and hydrates deeply. my skin feels much better and my skin is clear too. neem has a soothing effect on skin and also helps to heal acne marks/scars.",No Data Available
Garden of Glow Essence Serum with Vitamin C & Passion Fruit for Skin Illumination – 30 ml,No Data Available,No Data Available,"this serum has a direct effect on hyperpigmentation - including age spots, sun spots.",No Data Available
Flowers of Youth Essence Serum with Hyaluronic Acid & Hibiscus for Youthful Skin – 30 ml ,No Data Available,so far it is the best serum I have ever used. it has never had any side effects o my skin and is naturally effective.,"""My skin feels nourished and rejuvenated after 1 month of usage of this serum"" ""I have dull skin and I hardly find any product in the market that can suit my skin""",this is my second bottle and it has truly made my skin glow. i have no plans to replace it with any other brand or product for atleast the next 20 years.
Naturally Matte Liquid Lipstick - 3 ml | Chocolate Truffle,No Data Available,"Mamaearth lip serums do not dry the lips, and the color payoff is amazing. the chocolate truffle is just amazing and even though it is matte, it doesn't make the lips dry. the packaging, the product type and the natural ingredients make you feel safe.",the matte finish is really fantastic and lasts a long time. it has a hydrating effect and it makes the skin soft.,Mamaearth has managed to make me fall in love with their products once more. i loved this chocolate truffle shade because it is so amazing. the best part is it feels amazing. not patchy after hours and this truly worth buying.
Naturally Matte Liquid Lipstick - 3 ml | Chirpy Cherry,No Data Available,Mamaearth lipsticks are truly natural and very long lasting. this lipstick does not make my lips rough or dry.,my best friend got me this liquid matte lip serum...its so nyc... very amazing texture...it has reduced my damaged cells love the effect it gives after applying it...very satisfied!,nyc lip serum has no toxins and is paraben free too. i asked my brother this lipstick as my idi...and he bought it.
Naturally Matte Liquid Lipstick - 3 ml | Berryddict Magenta,No Data Available,"this lip serum is easy to apply and best for lips. it'll easily last 7-8 hours and won't make your lips chapped and dry. it'll last for at least 6-7 hours, the color is wonderful.",No Data Available,"mamearth's lip serum is smudge-proof, hydrating and easy to apply. the color is fantastic and it is a real sheer matte lipstick."
Naturally Matte Liquid Lipstick - 3 ml | Rosy Nude,No Data Available,No Data Available,the shade is soo soo amzng!! It's natural and the texture is also very light. it has a good fragrance and helped me get an acne free skin.,i got the complete range if this liquid matte lipstick nd kept all the nude shades and gave the red shades to my mom.
Naturally Matte Liquid Lipstick - 3 ml | Caramel Nude ,i am so happy and satisfied with this lip serum. its like a moisturiser to my lip with added benefits of lip colour.,Mama earth has always given amazing products. worth the money and so long lasting at this price is just amazing deal....,"Unlike any otehr matte lipstick, this never feels dry and dull. it has a beautiful matte finish with the serum effect as if it moisturises the skin.",chnce coz i bought this by chnce coz i had mama earth discount coupons. after using the product i realised what good quality it is.
Bye Bye Wrinkles Face Cream with Green Tea & Collagen for Wrinkles & Fine Lines – 30 g,No Data Available,No Data Available,Mamaearth's every product is awesome..no side effects till i have used..amazing..no side effects till i have used..,No Data Available
Bye Bye Open Pores Face Cream with Rosehip & Niacinamide For Pore Tightening – 30 g,No Data Available,No Data Available,this open pore cream effects on my open pores within 15 days. it is a nice light weight every day face cream so I m liking it.,No Data Available
Bye Bye Acne Face Cream with Willow Bark Extract & Salicylic Acid For Clear Skin – 30 g,No Data Available,i am in love with the after effects on my skin. it has reduced the dark spots.,i've been using this face cream for 30 days and it has given me true results. it's toxin free and has long lasting moisturising effect. the fragrance is so rich that it actually released my stress after a busy day.,No Data Available
Mamaearth Almond Hair Mask with Cold Pressed Almond Oil & Vitamin E for Healthy Hair Growth- 200 g,No Data Available,No Data Available,"it's all-natural, has a nice smell, and is best to use on a regular basis. I use it twice a week and that works.","the day I switched to this sweet almond hair mask, my hair is now healthier. i highly recommend people who are facing hair-thinning issues to use this product."
Oil-Free Face Wash with Apple Cider Vinegar & Salicylic Acid for Acne-Prone Skin– 100 ml,No Data Available,No Data Available,No Data Available,No Data Available
Mamaearth ME Eau De Parfum For a Fragrance As Unique As You - 8 ml Kit,No Data Available,No Data Available,No Data Available,No Data Available
Almond Beard Oil with Almond & Biotin For Beard Nourishment – 30 ml,No Data Available,No Data Available,No Data Available,No Data Available
Onion Beard Oil with Onion & Redensyl For Beard Growth – 30 ml,No Data Available,No Data Available,No Data Available,No Data Available
Tea Tree Beard Oil With Tea Tree & Salicylic Acid For Itch-Free Beard – 30 ml,No Data Available,No Data Available,No Data Available,No Data Available
Skin Radiance Body Care Kit - Ubtan Body Lotion & Vitamin C Body Lotion - (400 ml each),No Data Available,No Data Available,No Data Available,Best quality product: Best quality product.
Skin Refreshing & Soothing Body Care Kit - Rose Body Lotion + Vitamin C Body Lotion - (400 ml),No Data Available,No Data Available,No Data Available,No Data Available
Skin Nourishing Body Care Combo - Ubtan Body Lotion + Rose Body Lotion  - (400 ml),No Data Available,No Data Available,No Data Available,No Data Available
Vitamin C Body Lotion with Vitamin C & Honey for Radiant Skin - 400 ml   (Pack of 2),No Data Available,No Data Available,No Data Available,No Data Available
Ubtan Body Lotion with Turmeric & Kokum Butter for Glowing Skin - 400 ml  (Pack of 2),No Data Available,No Data Available,No Data Available,No Data Available
Rose Body Lotion with Rose Water & Milk for Deep Hydration (400 ml) - Pack of 2,No Data Available,No Data Available,No Data Available,No Data Available
Mamaearth ME Eau De Parfum For a Fragrance As Unique As You - 50 ml,No Data Available,I read about Mamaearth me perfume price it was quite affordable so I bought it and tested it. it really provided that unique smell as it suggested smell was nice and long lasting.,No Data Available,"the product quality is also very good, there is no fault, the delivery is also very good."
Vitamin C 100% Natural Lip Care Kit With Lip Scrub & Lip Mask For Pink and Plump Lips - 90 g,No Data Available,mamaearth lip care kit price just got my attention...and after using it. my lips are often getting chapped because of my dryness. the package moisturises the lips right away after usage.,No Data Available,Product quality best Awesome product.I really appreciate the high quality of the product Liked quality and it is effective.
Winter Essential Kit For Babies,No Data Available,No Data Available,No Data Available,No Data Available
Welcome Baby Essential Kit,No Data Available,No Data Available,No Data Available,No Data Available
Baby Essential Hamper Kit,No Data Available,No Data Available,No Data Available,No Data Available
Almond Conditioner with Almond Oil & Vitamin E for Healthy Hair Growth - 250 ml,No Data Available,No Data Available,No Data Available,almond conditioner- I really like this product as this make my hair less frizzy as it has vitamin E in which increases quality of hair.
Almond Shampoo with Cold Pressed Almond Oil and Vitamin E for Healthy Hair Growth - 250 ml,No Data Available,No Data Available,No Data Available,No Data Available
Almond Hair Oil with Cold Pressed Almond Oil & Vitamin E for Healthy Hair Growth - 150 ml	,No Data Available,i have been using badam oil for face for a couple of months now and am totally happy with the results. the almond oil price is worth the cost and i can see visible changes in my hair thickness and growth after applying. this almond oil for hair benefits my hair in various ways.,No Data Available,"mamaearth almond oil is an amazing value for money and works beautifully to maintain my hair. while almonds strengthen, vitamin E present in the oil keeps the scalp nourished. while almonds deeply nourish and strengthen hair, it makes them stronger."
Ubtan Nourishing Cold Cream with Turmeric & Saffron for Glowing Moisturization – 200 g,No Data Available,No Data Available,"Non greasy, and leaves a glowing effect. non greasy, and leaves a glowing effect.",Fab quality....after using it my skin feels like soooo soft n smooth. Made with natural ingredients like turmeric and saffron.
CoCo Nourishing Cold Cream With Coffee and Vitamin E For Rich Moisturization - 200 g,No Data Available,this best CoCo Nourishing Cold Cream for Oily skin offers multiple uses for skin nourishment. price is also reasonable and comparatively affordable than others.,No Data Available,i can feel the feathery touch after applying this product and yes it's long lasting.
Vitamin C Nourishing Cold Cream with Vitamin C & Honey for Illuminating Moisturization - 200 g,No Data Available,No Data Available,No Data Available,Good product quality good product quality good product quality good product quality good product quality good product quality good product quality good product quality good product quality good product quality good product quality good product quality good product quality good product quality good product quality good product quality good product quality good product quality good product quality good product quality good product quality good product quality good product quality good product quality good product quality good product quality good product quality good product quality good product quality good product quality good product quality good product quality good product quality good product quality good product quality good product quality good product quality good product
Ubtan Oil-Free Face Moisturizer for Skin Brightening - 80 ml,No Data Available,worth the price..an oil-free face moisturizer!,No Data Available,No Data Available
Ubtan Body Care Combo,No Data Available,No Data Available,No Data Available,Good quality products. Good quality products.
Aqua Glow Skin Refreshing Kit for Hydrated & Fresh Skin,Good quality and quick service.,No Data Available,No Data Available,Good quality and quick service.
Aqua Glow Skin Refreshing Combo for Hydrated & Fresh Skin,No Data Available,No Data Available,No Data Available,No Data Available
Mamaearth Vitamin C Tinted 100% Natural Lip Balm with Vitamin C & Honey - 2 g,No Data Available,Mamaearth Tint Lip Balm moisturises lips. It doesn't last longer on lips.,Mamaearth has the best tinted lip balms as they are 100% natural. moisturizing effect on lips is so good.,it moisturises lips. It doesn't last longer on lips.
Ubtan Tinted 100% Natural Lip Balm with Turmeric & Saffron - 2 g,No Data Available,h pr bhout kam quantity h price k according to h pr bhout kam quantity h price k according to h pr bhout kam quantity h price k according to h pr bhout kam quantity h price k according to h pr bhout kam quantity h price k according to h pr bhout kam quantity h price k according to h pr bhout kam quantity h price k according to,No Data Available,quality product... I highly recommend this.
Mamaearth Rose Tinted 100% Natural Lip Balm With Rose Oil and Castor Oil - 2 g,"mamaearth has a great range of skin,hair and body products. keep up the quality and service.","the product was good,but quantity is very less, price is little high",No Data Available,"mamaearth has a good range of skin,hair and body products with good quality. keep up the quality and service."
CoCo Tinted 100% Natural Lip Balm with CoCo and Vitamin E - 2g,No Data Available,i loved the cocoa tint. Would rate it 4 out of 5!,"this coco lip balm for girls by Mamaearth is so easy to use, has amazing fragrance. moisturizing effect lasts for a decent 2-3 hours but leaves chapped lips after that. the smell isn't great but isn't unpleasant either.",the cocoa tint is a win win but the fragrance isn't great either. the moisturizing effect lasts for a decent 2-3 hours on a busy day outside.
Mamaearth Cherry Tinted 100% Natural Lip Balm with Cherry and Coconut Oil - 2 g,No Data Available,No Data Available,No Data Available,Superb quality It good quality It good quality It good quality It good quality
Super Strawberry Body Lotion for Kids With Strawberry & Shea Butter - 400 ml,No Data Available,"the best strawberry body lotion India for babies. very nourishing and moisturizing for soft skin, no issues.",No Data Available,No Data Available
Original Orange Body Lotion For Kids With Orange & Shea Butter - 400 ml,No Data Available,the best thing is a fruity fragrance which my 6 year old daughter loves.,No Data Available,No Data Available
Major Mango Body Lotion For Kids with Mango Butter & Milk Protein - 400 ml,No Data Available,body lotion mango for kids is completely safe and gentle for baby's skin too. comes with an easy to use bottle.,No Data Available,the quality is just awesome.
Brave Blueberry Body Lotion For Kids with Blueberry and Kokum Butter– 400 ml,No Data Available,my friend once shared a blueberry softening gel lotion review for skin moisturization.,No Data Available,No Data Available
Agent Apple Body Lotion for Kids with Apple & Oat Milk– 400 ml,No Data Available,"apple body lotion is a go-to option for baby's skin. easy to use, and the apple body lotion price is economical too.",No Data Available,No Data Available
Charcoal Black Long Stay Kajal with Vitamin C & Chamomile for 11-Hour Smudge-free Stay,No Data Available,I bought this mamaearth charcoal black kajal online from website and since then this mamaearth charcoal black kajal is my favorite product it is long lasting and smooth finishing it is water prof I just love this product and the mamaearth charcoal kajal price is my pocket friendly and worth it.,No Data Available,mama Earth kajal is very good quality Product quality Good quality and safe to use thanks mama I like quality.
Charcoal Black Long Stay Kajal Kohl Pencil With Castor Oil and Chamomile For 11-Hour Smudge-free Stay with Free Sharpener,No Data Available,this is the best black kohl pencil that you can buy online or from any nearby store.,No Data Available,"Mamaeaerth's new makeup range is a mixture of safety, affordability and beauty. my daughter and i love the sharpness and boldness this kajal pencil provides us with."
Ubtan Night Cream with Turmeric & Saffron for Skin Brightening – 50 g,No Data Available,"this saffron cream review is good, and the price is reasonable. grab your pack, guys!",Mamaearth Ubtan night cream has no side effects. works as a regular night cream for dry skin too.,"Mamaearth offers a night cream for oily skin. a frequent buyer of Mamaearth hair serums, this cream cemented my trust."
Ubtan Nourishing Hair Removal Kit With Turmeric & Saffron for Hair Removal & Growth Reduction - 100+50 g,No Data Available,No Data Available,Amazing product...no side effects...no side effects...no side effects...no side effects...no side effects...no side effects...no side effects...no side effects...no side effects...no side effects...no side effects...no side effects...no side effects...no side effects...no side effects...no side effects...no side effects...no side effects...n,No Data Available
Vitamin C Under Eye Cream with Gotu Kola & Niacinamide for Brightening Under Eyes - 20 ml,No Data Available,"a dermatologist suggested using vitamin c eyecream for dark patches under the eyes. so, i ordered this one and as per my experience, it is the best under eye cream for dark circles.",vitamin c under eye cream works very well and reduced my wrinkles and dark circles. you can use this vitamin c eye cream with massager daily in your night care regimen for maximum effects.,Sehr good quality.
Ubtan Face Serum with Turmeric & Saffron for Skin Brightening – 30 ml,No Data Available,"there are so many ubtan face serum uses and benefits for the skin, especially for females. i have seen visible results with the usage of this ubtan face serum for oily skin.",It is easy to use. It has a soothing effect.,No Data Available
Ubtan Day Cream with Turmeric & Saffron for Skin Brightening – 50 g,No Data Available,"Mamaearth ubtan face cream is one of the best products, especially for female. every single review of this saffron cream is positive.",Mamaearth ubtan face cream has a soothing effect. my skin is getting better day by day.,Mamaearth ubtan face cream has a soothing effect. my skin is getting better day by day.
Ubtan Cleansing Milk with Turmeric & Saffron for Gentle Cleansing – 100ml,No Data Available,"also, I use Ubtan Cleansing Milk by Mamaearth after my workout. it is very refreshing, and makes my skin clean and refreshing.","Mamaearth ubtan cleansing milk is suitable for all skin types hence no other side effects. it reduces the signs of ageing, protects the skin from sun damage.",No Data Available
Rosehip Face Serum with Rosehip & Gotu Kola for Glowing Skin – 30 ml,No Data Available,Mamaearth’s non-greasy and deeply mositurizing rosehip oil face serum DIY offers deep moisturization to my skin.,"Mamaearth rosehip face serum works great on my skin. my skin is very sensitive, so I was very afraid of using this.",after using it for one week I can see the remarkable difference.it makes skin soft and glowing..I am in love with the product..I was earlier using serum of some other brand but after using it for one week I can see the remarkable difference.
Apple Cider Vinegar Face Mask With Apple Cider Vinegar & Rosehip Oil for Clear and Glowing Skin – 100 g,i love to say that you guys doing a great job i am very happy by the services and will keep on purchasing.,i use Mamaearth face mask- apple cider vinegar for face pigmentation. i have used it twice since first use along and already love the product.,No Data Available,No Data Available
Skin Correct Face Serum for Acne Marks & Scars - 15 ml,No Data Available,No Data Available,every product of mamaearth doesn't have any side effects safe for use. it removes my all pimples and scar from my face within the 2week.,"So good by quality, its so good by quality."
"Milky Soft Natural Lip Balm for Babies with Oats, Milk & Calendula – 4g",No Data Available,mamaearth lip balm for baby contains natural ingredients. she had her first child 5 months ago and he started developing chapped lips. mamaearth lip balm for baby contains natural ingredients.,No Data Available,No Data Available
10% Vitamin C Essence Serum with Vitamin C and Gotu Kola for Skin Illumination – 30ml,No Data Available,vitamin c serum mamaearth price is affordable and it is filled with the natural goodness. my skin texture has been improved after a use of 1 month only. also this vitamin c serum price is worth the cost.,No Data Available,"vitamin c is a potent antioxidant, which neutralizes free radicals. because of its antioxidant properties, vitamin C aids in the skin's natural regeneration process."
Retinol Face Mask with Retinol and Bakuchi for Fine Lines & Wrinkles - 100 g,No Data Available,No Data Available,Retinol face mask has nourished and hydrated my skin barrier without disturbing my sensitive skin. it can also be applied while using retinol serums.,Mamaearth's retinol face mask has shown amazing results in reducing fine lines and hyperpigmentation. it also goes gentle on your skin barrier and provides moisture.
Rice Wonder Water With Rice Water & Keratin For Detangled Hair in 7 Seconds - 100 ml,No Data Available,Mamaearth Rice Wonder Water price fits every budget and is quite more effective than the products I have used so far.,No Data Available,the quality of the mama earth products are very helpful and heavy. the quality of the mama earth products are very helpful.
Aqua Glow Gel Face Moisturizer With Himalayan Thermal Water and Hyaluronic Acid for 72 Hours Hydration - 100ml,No Data Available,"i'm already in love with all ur products, but with this Aqua range, i'm in love with the packaging too. all the mamaearth products be it hair, body or face products are awesome and worth the price, quantity and quality.",I like this glow face moisturizer....feels refreshing and gives cooling effect. I'm dropping this review so that people can get an ideaa of the product.,"all the mamaearth products be it hair, body or face products, all are awesome and worth the price, quantity and quality."
Aqua Glow Face Serum with Himalayan Thermal Water and Hyaluronic Acid - 30 ml,No Data Available,"Mamaearth foundation is good to skin, Provides bright glowing skin, Subtle makeup look. little bit expensive price so normal people can not buy this product.",Mamaearth Aqua Glow Face Serum has helped me restore the radiance.,No Data Available
Aqua Glow Hydrating Sunscreen Gel with Himalayan Thermal Water and Hyaluronic Acid - 50 g,No Data Available,No Data Available,"one of the best sunscreen ever. doesn't feel heavy at all very light, moisturising and gives instant cooling effect.",No Data Available
"Milky Soft Bathing Bar for Babies with Oats, Milk and Calendula - 75g x 2 ",No Data Available,No Data Available,No Data Available,No Data Available
Onion Shampoo for Hair Growth and Hair Fall Control with Onion and Plant Keratin - 1 Litre,No Data Available,No Data Available,No Data Available,I love this product. Quality is really very nice.
Natural Nourishing Bathing Soaps - 5x75g,No Data Available,the mama earth soap price is all worth it acc to the quality I seem.,No Data Available,all products are very good and I expected henna products from u.s.
Charcoal Nourishing Bathing Soap With Charcoal and Mint for Deep Cleansing - 5x75g,No Data Available,"Mama earth charcoal bathing soap is best for smooth, healthy and glowing skin. price is easily affordable and with excellent results.",there has been visible activated charcoal soap before and after effects on my skin. Mamaearth Charcoal Bathing Soap makes my skin so soft and clean.,Quality is good but prices are high.
Vitamin C Nourishing Bathing Soap With Vitamin C and Honey for Skin Illumination - 5x75g,No Data Available,No Data Available,No Data Available,No Data Available
Tea Tree Nourishing Bathing Soap With Tea Tree and Neem for Skin Purification - 5x75g,No Data Available,No Data Available,this tea tree nourishing bathing soap has no side effect. compared to other products I felt it secured one.,No Data Available
CoCo Nourishing Bathing Soap with Coffee and Cocoa - 5*75g,No Data Available,No Data Available,No Data Available,No Data Available
Ubtan Nourishing Bathing Soap With Turmeric and Saffron - 375g,No Data Available,No Data Available,No Data Available,No Data Available
Milky Soft Diaper Rash Cream for Babies - 50g,No Data Available,"Mamaearth rash cream for newborn is good. it gives effective results, comes in fairly good quantity.",No Data Available,No Data Available
"Milky Soft Body Lotion for Babies with Oats, Milk and Calendula - 400ml",No Data Available,the Body Milk Lotion price is reasonable for the numerous benefits it has. it is gentle and nourishing.,No Data Available,No Data Available
"Milky Soft Body Wash for Babies with Oats, Milk and Calendula - 400 ml",No Data Available,No Data Available,No Data Available,"really good quality and nice products I love this product, thank you mamaearth for giving me very very nice body wash for my baby."
"Milky Soft Shampoo with Oats, Milk and Calendula for Babies - 400 ml",No Data Available,No Data Available,No Data Available,"Mamaearth shampoo has calmed inflamed scalp and made hair sooo soft. has a gentle fragrance, no eye irritation, and offers effective hair care."
Charcoal Face Wash with Activated Charcoal and Coffee for Oil Control - 250ml,No Data Available,No Data Available,No Data Available,the face wash is very gud and it's quality is making me drop a mamaearth charcoal face wash review about it.
Vitamin C Day and Night Combo,No Data Available,No Data Available,No Data Available,No Data Available
