PRODUCT_NAME,Service Summary,Price Summary,Effect Summary,Quality Summary
Vitamin C Oil-Free Moisturizer For Face with Vitamin C and Gotu Kola for Skin Illumination - 80 ml,No Data Available,"i was looking for a good moisturiser for my sensitive skin a few days ago when i came across this product and mamaearth vitamin c moisturizer price looked also affordable. it persuaded me in some way, and so I bought it. this is the greatest moisturiser I've ever used, and the best moisturiser to use after using vitamin C serum.",No Data Available,mamaearth vitamin c moisturizer has helped me with my acne problem. i wish to congratulate mamaearth for coming up with such a quality formulation. no chemicals only natural ingredients. Made safe certified.
Tea Tree Oil-Free Face Moisturizer with Tea Tree and Salicylic Acid for Acne and Pimples - 80 ml,No Data Available,cnn.com's ireport boot camp challenges ireporters to try a new moisturizer. cnn.com's ireport boot camp challenges ireporters to try a new moisturizer.,my entire family uses this tea tree moisturizer for face on a daily basis and is hooked to its visible effects with a beautiful smell.,cnn.com's ireport boot camp challenges ireporters to try a new moisturizer. cnn.com's ireport boot camp challenges ireporters to try a new moisturizer.
Aqua Glow Face Wash With Himalayan Thermal Water and Hyaluronic Acid for Intense Hydration - 100ml,No Data Available,No Data Available,this is really amazing one. It feels so refreshing and gives a cooling effect after washing face.,Excellent product with good quality with good quality.
Vitamin C Night Cream with Vitamin C and Gotu Kola for Skin Illumination - 50g,No Data Available,No Data Available,No Data Available,No Data Available
Skin Illuminate Face Serum for Radiant Skin with Vitamin C and Turmeric - 15g ,No Data Available,"the Mamaearth Skin Illuminate Face Serum price is reasonable. within three weeks, i can see the changes in my skin.",Nice serum quality no side effect on face.very smooth good for skin.very smooth good for skin.very smooth good for skin.very smooth good for skin.,nice serum quality no side effect on face.very smooth good for skin.
Apple Cider Vinegar Hair Mask with Organic Apple Cider Vinegar and Biotin for Long and Shiny Hair - 200 g,No Data Available,No Data Available,No Data Available,apply this apple hair mask and see the magical change in your hair quality. i tried and tested it personally.
Rice Water Hair Mask with Rice Water and Keratin For Smoothening Hair and Damage Repair - 200 g,No Data Available,No Data Available,Mask for about two months on my hair has improved so much I just love its effect on my Hair the Quality of my hair has become more healthy and fresh free it also helps me in keeping my hair fall in control,Mask for about two months on my hair has improved so much I just love its effect on my Hair the Quality of my hair has become more healthy and fresh free it also helps me in keeping my hair fall in control
Tea Tree Spot Gel Face Cream with Tea Tree and Salicylic Acid For Acne and Pimples - 15 g ,No Data Available,the best cream to remove pimples/acne spots effectively. i've been using it for 3-4 days and have already noticed a difference.,No Data Available,I have personally used it and had observed it's efficiency.
Apple Cider Vinegar Conditioner with Organic Apple Cider Vinegar and Biotin for Long and Shiny Hair - 250ml,No Data Available,No Data Available,"Mamaearth products are nice, safe, and lightweight with no side effects. i started using their de-tan face mask and face wash. i am hooked to this Apple Cider Vinegar Conditioner.",No Data Available
Apple Cider Vinegar Shampoo with Organic Apple Cider Vinegar and Biotin for Long and Shiny Hair - 250ml,No Data Available,No Data Available,No Data Available,Mamaearth apple cider vinegar shampoo for dandruff and hair growth helped me and my husband strengthen our scalp and improve hair quality.
Damage Repair Kit,No Data Available,Good product with good price.,No Data Available,No Data Available
Damage Repair Combo,No Data Available,No Data Available,no side effects and its quickly stops hair fall and remove dandruff as well.,No Data Available
Vitamin C Ultra Light Gel Oil-Free Moisturizer with Vitamin C and Aloe Vera Water for Glowing Hydration - 200 ml,No Data Available,No Data Available,very nourishing and moisturizing cream- I have bought this product twice in the last few months. its cooling effect is so calming to my skin that made me buy this product twice in the last two months.,aloe vera gel with vitamin c to heal sunburn and tanning. i am in love with the consistency and efficiency of this skincare product.
Ubtan Ultra Light Gel Oil-Free Moisturizer with Turmeric and Saffron for Deep Hydration - 200 ml,No Data Available,Mamaearth Ubtan Gel is rich in fats and vitamins that keep my skin healthy and nourished. it is very light on the skin and absorbs quickly. it moisturizes perfectly and is well worth the price.,I like this product because... they have no side effects... they have no side effects...,No Data Available
Original Orange Body Wash For Kids with Orange and Oat Protein - 300 ml,No Data Available,No Data Available,No Data Available,my son enjoys bathing time now thanks to this amazing body wash orange.
Brave Blueberry Body Wash For Kids with Blueberry and Oat Protein - 300 ml,No Data Available,No Data Available,No Data Available,"this Mamaearth kids body wash blueberry is Made Safe certified. it is also free from chemicals and toxins, which is why it is the most trustworthy brand."
Agent Apple Body Wash for Kids with Apple and Oat Protein - 300 ml,the product is amazing... Its smell and the everything is perfect. Must buy..,No Data Available,No Data Available,No Data Available
Major Mango Body Wash For Kids with Mango and Oat Protein - 300 ml,No Data Available,No Data Available,No Data Available,No Data Available
Apple Cider Vinegar Foaming Face Wash with Apple Cider Vinegar and Aloe Vera Water for Deep Cleansing - 150ml,No Data Available,No Data Available,the best no itching no irritation.the best no itching no irritation.the best no itching no irritation.,apple cider vineger mamaearth face wash was amazing. i also purchased mamaearth face serum and sunscreen. both are very good product.
Ubtan Foaming Face Wash with Turmeric and Saffron for Tan Removal - 150ml,the exfoliating silicone brush is well designed and the smell is decent. overall happy with the purchase and service is quite appreciable.,I absolutely liked this product its brush is really soft and i didn't expect such an amazing product at such a low price.,too good and useful product with no side effect. no harmful effects and even pocket dictionary.,all the products of mamaearth are very good and the quality is quite appreciable.
Body Wash Combo: Vitamin C Body Wash and Charcoal Body Wash,No Data Available,No Data Available,No Data Available,Mamaearth vitamin C body wash deeply cleanses for body of skin. and also charcoal body wash for removes skin impurities with natural ingredients.
Super Strawberry Body Wash for Kids with Strawberry and Oat Protein - 300 ml,Good quality and customer service. Highly recommended.,No Data Available,No Data Available,i ordered a baby wash for my 2.5 year old baby. it smells amazing and keeps the baby skin soft.
"Vitamin C Face Scrub for Glowing Skin, With Vitamin C and Walnut For Skin Illumination - 100 g",No Data Available,No Data Available,Mamaearth Vitamin C scrub has successfully faded my sun tan. it doesn't disturb my skin's moisture content.,Mamaearth Vitamin C scrub benefits have restored my faith in cosmetics. by far the best vitamin c scrub for oily skin. the silver lining is its nourishing composition.
Rice Water Shampoo For Damage Repair - 250ml,No Data Available,Mamaearth rice water shampoo is the best rice water shampoo on the market. the rice water shampoo provides many nourishing benefits to hair.,"mamaearth product are pretty good especially while we think of hair care. maybe it would not much effective for hairfall, you need to keep using it.",Good quality Good quality Good quality Good quality Good quality Good quality Good quality Good quality Good quality Good quality Good quality Good quality Good quality Good quality Good quality Good quality Good quality Good quality Good quality Good quality Good quality Good quality Good quality Good quality Good quality Good quality Good quality Good quality Good quality Good quality Good quality Good quality Good quality Good quality Good quality Good quality Good quality Good quality Good quality Good quality Good quality Good quality Good quality Good quality Good quality Good quality Good quality Good quality Good quality Good quality Good quality Good quality Good quality Good quality Good quality Good quality Good
Rice Hair Oil with Rice Bran and Coconut Oil For Damage Repair - 150ml,Really great... Good quality product accompanied with best customer service.,No Data Available,"made my hair really soft just after one use, i am amazed with the impact never felt my hair so good before.",Really great... Good quality product accompanied with best customer service.
"Rice Water Conditioner with Rice Water and Keratin for Damaged, Dry and Frizzy Hair - 250 ml",No Data Available,No Data Available,No Data Available,No Data Available
"Tea Tree Face Mask for Acne, with Tea Tree and Salicylic Acid for Acne and Pimples - 100g",No Data Available,No Data Available,No Data Available,No Data Available
Tea Tree Body Wash With Tea Tree and Neem For Skin Purification - 300 ml ,No Data Available,No Data Available,No Data Available,the quality of body wash is excellent. Its smell very energetic after using it.it cleans the body very well.it is tea tree it is very good for skin.
Ubtan Body Wash With Turmeric and Saffron for Glowing Skin - 300 ml,No Data Available,"i loved the way it leaves my skin after the wash, soft and supple. Definitely worth the price, it has zero side effects.","i loved the way it leaves my skin after the wash, soft and supple. Definitely worth the price, it has zero side effects.",product quality Quality is the best The smell of this product is outstanding and also the quality of the product is very good.
CoCo Body Wash With Coffee and Cocoa For Skin Awakening - 300 ml  ,No Data Available,No Data Available,best body wash with coffee and cocoa.,No Data Available
Charcoal Body Wash With Charcoal and Mint for Deep Cleansing - 300 ml,No Data Available,"Mamaearth Charcoal Body Wash is easy to use, reasonably priced, and so natural on the skin. the after-effect feels good on my skin.","Mamaearth Charcoal Body Wash is easy to use, reasonably priced, and so natural on the skin.",i used charcoal body wash only two time evening and morning...and I m facing skin rashes and skin itching problem... Cheaper quality on high cost...
Vitamin C Body Wash with Vitamin C and Honey for Skin Illumination - 300ml,great experience with this body wash my skin very smooth n shine.,Mamaearth Vitamin C Body Wash is easy to use and fairly priced.,No Data Available,No Data Available
"Retinol Night Cream For Women with Retinol and Bakuchi for Anti Aging, Fine Lines and Wrinkles - 50 g",No Data Available,"mamaearth anti aging cream keeps skin hydrated and reduces fine lines. price is expensive, but how it works on my skin makes me ignore the price. use twice a day and you will see your skin glows.",No Data Available,No Data Available
Retinol Face Wash with Retinol and Bakuchi for Fine Lines and Wrinkles - 100 ml,No Data Available,No Data Available,Mamaearth Retinol Face Wash works equally well for oily skin and for dry skin too. it is made of natural ingredients and no side effects in face.,No Data Available
Niacin Face Toner with Niacinamide and Witch Hazel for Acne and Open Pores - 200 ml,No Data Available,Mamaearth Niacin Toner is one of the best solutions for reduces acne marks. it can be used daily and comes at a very reasonable price.,No Data Available,No Data Available
Tea Tree Foaming Face Wash with Tea Tree and Salicylic Acid for Acne and Pimples - 150ml,No Data Available,it has been 2 weeks since i have been using it twice a day. it has been very good at reducing acne and excess oil deposits. the salicylic face wash ingredients are natural and safe and wouldn’t cause harm.,mama earth tea tree face wash works like a magic wand on acne and pimples. it really helps me out with my acne problem n has no harmful effect on my skin.,the charcoal face wash works super well... took away dirt n oil.. made my skin so smooth n cleared it out...
Tea Tree Face Serum for Acne and Pimples - 30 ml,No Data Available,"recently, I started using Tea Tree Serum by Mamaearth and the results have been so satisfying.",No Data Available,No Data Available
Retinol Face Serum,No Data Available,No Data Available,"hyaluronic acid and hyaluronic acid have been used in the last two months. this is a great, light moisturizer with a pleasant scent.",No Data Available
Vitamin C Skincare Regimen Kit,No Data Available,"mamaearth vitamin c face kit price is the best skin treatment kit i have seen. i can say that it has helped me achieve clean, clear, and glowing skin.",No Data Available,V good quality product.
Tea Tree Hair Oil with Tea Tree and Ginger Oil for Dandruff Free Hair - 250ml,Products are satisfying and service is totally remarkable.,mamaearth tea tree oil for hair dandruff has made my life easy. you can also buy it online after checking out the reviews.,dandruff treatment really cured my dandruff problem from the first wash itself.,i was suffering from lot dandruff...i applied tea tree hair oil regularly on my hair and actually got satisfied with the results.
Argan Hair Oil with Argan Oil and Avocado Oil for Frizz-Free and Stronger Hair - 250 ml,No harmful chemicals accompanied with good customer service and products.,No Data Available,argan oil is 100% natural so this showed the quick effect. my skin now feels more rejuvenated by the frequent use of oil just before sleep.,"good hair oil is all you need for stronger, for frizz-free hair, and for good locks. Backed by castor oil, avocado oil, and coconut oil, it will help you to achieve the hair quality that you have dreamt of."
Ubtan Night Face Mask with Turmeric and Niacinamide for Glowing Skin - 100 g,Good product with good customer service.,Awesome product and price worthy.,i used this ubtan 2 times a week for 3 months continuously and i saw really good effects it was recommended by my friends and i'm happy with the results. i like Mama Earth products i can see results skin each and every product is good no side effects.,No Data Available
Essential Anti-Hair Fall Kit,mamaearth is a great hair care product. i think now i can care my hair with mamaearth.,No Data Available,i m in totally love with this product.....such an amazing product....it completely helps you in your hair problems and the best thing is that it is free of chemicals.,Quality is too osmm Quality is too osmm Quality is too osmm
"Nourishing Bathing Bar Soap For Kids - ( Pack of 5, 75g Each)",No Data Available,No Data Available,No Data Available,"the soap leaves the baby's skin soft, moisturized and doesn't dry it out at all. my daughter has dry and sensitive skin. after using the soap her skin is not appearing dry."
Hyaluronic Bamboo Sheet Mask with Rosehip Oil for Soft and Plump Skin - 25 g,No Data Available,No Data Available,this hyaluronic acid sheet mask helped me treat my insecurities. also gave my skin a soothing effect making me feel relaxed.,Best quality.
Retinol Bamboo Sheet Mask with Retinol and Bakuchi for Fine Lines and Wrinkles - 25 g,No Data Available,"after my skin started to feel soggy, i decided to buy and use the best face pack for older skin. that’s when i came across Mamaearth sheet mask of retinol. it made my skin feel soft and timeless over a period of time.","my mother loved the after effect of the sheet mask. she felt nourished, soft and glowing.",No Data Available
Ubtan Bamboo Sheet Mask with Turmeric and Saffron for Skin Brightening - 25 g,No Data Available,No Data Available,it has a soothing effect. I like the texture and after effects of this product.,No Data Available
Rice Water Bamboo Sheet Mask with Rice Water and Coconut Milk for Deep Hydration - 25 g ,No Data Available,No Data Available,No Data Available,No Data Available
Rose Water Bamboo Sheet Mask with Rose Water and Milk for Glowing Skin - 25 g,No Data Available,No Data Available,No Data Available,No Data Available
Vitamin C Bamboo Sheet Mask with Vitamin C and Honey for Skin Illumination - 25 g,No Data Available,No Data Available,No Data Available,No Data Available
Charcoal Face Wash and Scrub Combo,No Data Available,the price is genuine and really pocket friendly making it accessible for anyone to purchase and use it at least once.,No Data Available,No Data Available
Onion Shampoo and Onion Hair Serum Combo,I like all product. Very good quality and customer service.,No Data Available,No Data Available,I like all product. Very good quality and customer service.
Hair Fall Reduction Combo,"product is not good,my hair is falling more after using it. when i contacted customer service,he said rudely to not use it.",this mamaearth hair care combo is something i am using for my hair. it gives best results in cheap pricing...Keeps my hair healthy and well nourished.,Amazing product with no side effects with no side effect.,Mamaearth onion range is really effective and quality is too good.
Onion Shampoo and Oil Combo,No Data Available,mamaearth onion hair oil and shampoo is the Great combination for hair regrowth. the price was quite expensive acc to my budget...but after using it...and they gave me so good results.,mamaearth hair products combo is something i cant get enough of...love this combo...my hair looks so much better and gives them a shiny effect...love this combo...love this combo...love this combo...love this combo...love this combo...love this combo...love this combo...love this combo...love this combo...love this combo...love this combo...love this combo...love this combo...love this combo...love this combo...love this,price was quite expensive acc to my budget...but after using it...i am getting the quality and the results...so price is worth it.
Onion Shampoo for Hair Growth and Hair Fall Control (250 ml) - Pack Of 2,Good product with good customer service.,No Data Available,onion shampoo and conditioner increased my hairfall problem. i used this shampoo multiple times to see the effectiveness.,No Data Available
Vitamin C Face Wash with Vitamin C and Turmeric for Skin Illumination - 250ml,No Data Available,No Data Available,this is my saviour my skin has never been so bright and beautiful i would really go for it again this is my saviour.,Good quality This product value for money and amazing quality.
Tea Tree Face Wash with Neem for Acne and Pimples - 250ml,No Data Available,No Data Available,I use this face wash with tea tree and neem tice everyday. it has a gentle but effective cleaning effect and keeps skin hydrated after wash.,"Good quality product Good quality good packages pimple clean Yes, Yes, Yes, Yes, Yes, Yes, Yes, Yes, Yes, Yes, Yes, Yes, Yes, Yes, Yes, Yes, Yes, Yes, Yes, Yes, Yes, Yes, Yes, Yes, Yes, Yes, Yes, Yes, Yes, Yes, Yes, Yes, Yes, Yes, Yes, Yes, Yes, Yes, Yes, Yes, Yes, Yes, Yes, Yes, Yes, Yes."
Spotless Skin Combo: Ubtan Facewash - 100ml and Bye Bye Blemishes Face Cream - 30ml,No Data Available,the ubtan face wash is very refreshing with goodness of turmeric and saffron and bye bye blemishes is also very good product with a light smell it is not very oily.,bye bye blemish cream and ubtan face wash give good effect. hydrating n gives moisturising effect.,Good quality product Product quality is very good Product quality is very good product quality is very good product quality is very good product quality is very good product quality is very good product quality is very good product quality is very good product quality is very good product quality is very good product quality is very good product quality is very good product quality is very good product quality is very good product quality is very good product quality is very good product quality is very good product quality is very good product quality is very good product quality is very good product quality is very good product quality is very good
Tea Tree Face Scrub with Tea Tree and Neem for Skin Purification - 100g,No Data Available,"for face tea tree facial scrub, benefits are immense. I bought it online for a fair price and it has become my regular.",No Data Available,No Data Available
Plant-Based Diaper Pants for Babies – 12-17 kg (Size XL - 30 Diapers),No Data Available,"my niece recommended Mamaearth Diaper Pants XL. it is the best diaper in terms of softness, comfort and 2X absorption power.",No Data Available,mamaearth diapers are so affordable and good of this brand. they also have baby diapers xl size.
Plant-Based Diaper Pants for Babies – 9-14 kg (Size L - 30 Diapers),No Data Available,No Data Available,No Data Available,No Data Available
Plant-Based Diaper Pants for Babies – 7-12 kg (Size M - 30 Diapers),No Data Available,No Data Available,No Data Available,quality of diaper is really good and comfortable for babies. Keep up the good work.
Plant-Based Diaper Pants for Babies – 4-6 kg (Size S - 30 Diapers),No Data Available,No Data Available,No Data Available,"plant-based diapers have a great 2x absorption capacity, and are the softest and safest. the soft skin of my baby is always happy because she has so far never had any rashes."
Plant-Based Diaper Pants for Babies – 3-5 kg (Size NB - 40 Diapers),No Data Available,kudos to mamaearth for such a wonderful product. made of natural ingredients and keeps baby's soft skin healthy.,No Data Available,kudos to mamaearth for such a wonderful product. made of natural ingredients and keeps your baby's soft skin healthy and safe.
Acne Marks Reduction Kit,No Data Available,i bought the acne control kit after reading the reviews and have been pleasantly surprised. it works well for men too.,"cnn's kat kinsman has been suffering from pimples for a long time. tried various anti pimple creams for oily skin but there was no success. found this acne pack kit and the effect was instant, the oil on my skin reduced.",the best part of this oily skin pimples removal cream is that it is all natural. pimple reducing cream that are available in the market are not natural and also not suitable for all type of skin.
Onion Scalp Serum with Onion and Niacinamide for Healthy Hair Growth - 50ml,No Data Available,Mamaearth scalp serum for hair growth is enriched with Onions. it is one of the best serum for dry scalp online to buy in india.,i've been using this serum since past 1 month. i apply it on the roots before oiling my hair and keep it overnight. it is really showing its effect.,Quality is th best Very good Product....I love it...very good quality...very good product...very good quality...very good product...very good quality...very good product...very good quality...very good product...very good quality...very good product...very good quality...very good product...very good quality...very good product...very good quality...very good product...very good quality...very good product...very good quality...very good product...very good quality...very good product...very good quality...very good product...very good quality...
Vitamin C Body Lotion with Vitamin C and Honey for Radiant Skin - 400 ml  ,No Data Available,vitamin c lotion is very nourishing and gives glowing skin. ubtan lotion is also good and gives glowing skin as the ingredients are turmeric and kokum butter.,Mamaearth ubtan body lotion improve skin texture and enhance its suppleness while keeping it hydrated for long hours.,No Data Available
Ubtan Body Lotion with Turmeric and Kokum Butter for Glowing Skin - 400 ml,No Data Available,after applying my skin feel hydrated. after applying my skin feel hydrated.,this Mamaearth ubtan body lotion improves skin texture and enhances its suppleness. made my skin super smooth and no side effects.,Mamaearth ubtan body lotion is so effective. After applying my skin feel hydrated. It's a Nice Product.
CoCo Body Lotion With Coffee and Cocoa for Intense Moisturization - 400ml ,No Data Available,coco glow lotion is worth the price and a must buy. it is totally up to the hype and the price too.,No Data Available,body lotion is very good quality. fragrances too strong but body lotion is very good quality.
Rose Body Lotion with Rose Water and Milk For Deep Hydration - 400ml,No Data Available,you can check the review and rose body lotion price from the website. switching over to this rose body cream for oily skin helped me overcome my skin problems.,"this body lotion is superb, it has non greasy consistency, and has a calming and soothing effect. after using it leaves a long lasting fragrance for at least 12 hours, its a must try for every body.","the texture, quality, quantity, packaging everything was amazing."
Mamaearth Fruit Punch Toothpaste,No Data Available,Mamaearth Fruit Punch Toothpaste has helped me in soothing my baby’s gums and keeping her baby’s good oral hygiene.,No Data Available,No Data Available
